[
    {
        "x": 78,
        "fontSize": 9,
        "origin": "top-left",
        "type": "text",
        "y": 94,
        "w": 200,
        "page": 1,
        "name": "part1_name",
        "h": 14,
        "static": { "configKey": "ratedNCO.name" }
    },
    {
        "x": 460,
        "fontSize": 9,
        "origin": "top-left",
        "type": "text",
        "y": 94,
        "w": 40,
        "page": 1,
        "name": "part1_rank",
        "h": 14,
        "static": { "configKey": "ratedNCO.rank" }
    },
    {
        "x": 555,
        "fontSize": 8,
        "origin": "top-left",
        "type": "text",
        "y": 94,
        "w": 50,
        "page": 1,
        "name": "part1_pmosc",
        "h": 14,
        "static": { "configKey": "ratedNCO.pmosc" }
    },
    {
        "x": 78,
        "fontSize": 7,
        "origin": "top-left",
        "type": "text",
        "y": 117,
        "w": 380,
        "page": 1,
        "name": "part1_organization",
        "h": 14,
        "static": { "configKey": "unit.fullDesignation" }
    },
    {
        "x": 78,
        "fontSize": 8,
        "origin": "top-left",
        "type": "text",
        "y": 147,
        "w": 80,
        "page": 1,
        "name": "part1_periodFrom",
        "h": 14,
        "static": { "configKey": "ratingPeriod.from" }
    },
    {
        "x": 210,
        "fontSize": 8,
        "origin": "top-left",
        "type": "text",
        "y": 147,
        "w": 80,
        "page": 1,
        "name": "part1_periodThru",
        "h": 14,
        "static": { "configKey": "ratingPeriod.thru" }
    },
    {
        "x": 430,
        "fontSize": 9,
        "origin": "top-left",
        "type": "text",
        "y": 147,
        "w": 50,
        "page": 1,
        "name": "part1_reasonCode",
        "h": 14,
        "static": { "configKey": "ratingPeriod.reasonCode" }
    },
    {
        "x": 490,
        "fontSize": 9,
        "origin": "top-left",
        "type": "text",
        "y": 117,
        "w": 60,
        "page": 1,
        "name": "part1_uic",
        "h": 14,
        "static": { "configKey": "unit.uic" }
    },
    {
        "x": 38,
        "fontSize": 9,
        "origin": "top-left",
        "type": "text",
        "multiline": true,
        "y": 458,
        "w": 540,
        "page": 1,
        "name": "part3_dailyDuties",
        "h": 62,
        "llm": { "generate": true, "promptKey": "part3_daily_duties", "maxTokens": 400 }
    },
    {
        "x": 38,
        "fontSize": 9,
        "origin": "top-left",
        "type": "text",
        "multiline": true,
        "y": 532,
        "w": 540,
        "page": 1,
        "name": "part3_specialEmphasis",
        "h": 20,
        "llm": { "generate": true, "promptKey": "part3_special_emphasis", "maxTokens": 150 }
    },
    {
        "x": 38,
        "fontSize": 9,
        "origin": "top-left",
        "type": "text",
        "multiline": true,
        "y": 565,
        "w": 540,
        "page": 1,
        "name": "part3_appointedDuties",
        "h": 17,
        "llm": { "generate": true, "promptKey": "part3_appointed_duties", "maxTokens": 100 }
    },
    {
        "x": 38,
        "fontSize": 8,
        "origin": "top-left",
        "type": "text",
        "multiline": true,
        "y": 625,
        "w": 540,
        "page": 1,
        "name": "part4_ptComments",
        "h": 42,
        "llm": { "generate": true, "promptKey": "part4_pt", "maxTokens": 200 }
    },
    {
        "x": 208,
        "fontSize": 8,
        "origin": "top-left",
        "type": "text",
        "multiline": true,
        "y": 686,
        "w": 370,
        "page": 1,
        "name": "part4_cComments",
        "h": 68,
        "llm": { "generate": true, "promptKey": "part4_character", "maxTokens": 200 }
    },
    {
        "x": 208,
        "fontSize": 8,
        "origin": "top-left",
        "type": "text",
        "multiline": true,
        "y": 74,
        "w": 370,
        "page": 2,
        "name": "part4_dComments",
        "h": 68,
        "llm": { "generate": true, "promptKey": "part4_presence", "maxTokens": 200 }
    },
    {
        "x": 208,
        "fontSize": 8,
        "origin": "top-left",
        "type": "text",
        "multiline": true,
        "y": 164,
        "w": 370,
        "page": 2,
        "name": "part4_eComments",
        "h": 68,
        "llm": { "generate": true, "promptKey": "part4_intellect", "maxTokens": 200 }
    },
    {
        "x": 208,
        "fontSize": 8,
        "origin": "top-left",
        "type": "text",
        "multiline": true,
        "y": 258,
        "w": 370,
        "page": 2,
        "name": "part4_fComments",
        "h": 68,
        "llm": { "generate": true, "promptKey": "part4_leads", "maxTokens": 200 }
    },
    {
        "x": 208,
        "fontSize": 8,
        "origin": "top-left",
        "type": "text",
        "multiline": true,
        "y": 348,
        "w": 370,
        "page": 2,
        "name": "part4_gComments",
        "h": 68,
        "llm": { "generate": true, "promptKey": "part4_develops", "maxTokens": 200 }
    },
    {
        "x": 208,
        "fontSize": 8,
        "origin": "top-left",
        "type": "text",
        "multiline": true,
        "y": 438,
        "w": 370,
        "page": 2,
        "name": "part4_hComments",
        "h": 68,
        "llm": { "generate": true, "promptKey": "part4_achieves", "maxTokens": 200 }
    },
    {
        "x": 30,
        "fontSize": 8,
        "origin": "top-left",
        "type": "text",
        "multiline": true,
        "y": 552,
        "w": 555,
        "page": 2,
        "name": "part4_jComments",
        "h": 54,
        "llm": { "generate": true, "promptKey": "part4_overall", "maxTokens": 300 }
    },
    {
        "x": 188,
        "fontSize": 8,
        "origin": "top-left",
        "type": "text",
        "multiline": true,
        "y": 645,
        "w": 370,
        "page": 2,
        "name": "part5_bComments",
        "h": 78,
        "llm": { "generate": true, "promptKey": "part5_sr_comments", "maxTokens": 300 }
    }
]
